,title,review,hour,min_order,address,menu,menu_img
534,빙달-충무로점,청포도 했다가 사장 친절하시고 빙수  짜리 손바닥 마카롱 먹었네요 가격 이길래 마카롱 세트 멍청한 착각 이돈 연유 살걸 유미 포함 일줄은 상상 못햇 써져있는데 못봣어용 죄숩니  존맛 딸기 빙수 먹었었는데 냉동 딸기 아쉬웠는데 청포도 상큼 맛있어서 사진 찍었어요 분도 친절하시고 빙수 시키고 맛있어서 어제 그저께 인분 시켰는데 인분 번창 하세요 얼음 자체 밀크 얼음 잇긴한데 아쉽네요 양도 많고 빙달 없는듯 맛있네요 상콤 하구 야식 만족했어요 단점 슬빙 적습니다 아쉽죠 좋았는데 늦어 전화하니 주소 확인 안하시고 보내셨다고 시작 늦게 누르신 시작 늦게 누르셨고 제때 시작 됬다고 왔었는데 고객 확인 하셨으면 기분 나쁘진 않았을것 짜장면 전화하면 갔어요 하는것 마냥 청포도 많았어요 과일 먹고 싶어서 시킨 였는데 과일 냉동 딸기 딸기 양도 많아용 인절미 오겠거니 종이컵 사이즈 가득 와서 놀랐어요 인절미 부드럽고 딸기 빙수 팥빙수 먹는게 어울릴 인절미 간식 팥빙수 망고 빙수 볼래요 기대 돼요 잘멋었습니 쏘였습니다 두번째 달달 과일 땡겨서 망고 시켰어요 모해 자체 타피오카 쫀독쫀독해 저번 커피콩 맛있어서 했네요 받았습니다 최고 잠자기 직전 그릇 뚝딱 기분 좋게 잤어요 맛있네요 정성 가득 부드러움 가득한 빙달 드셔 보세요 토핑 떡왜 부드러운지 아몬드 치즈 케익 우유 빙수 일품 먹고싶다 재료 들어져 꾸미면서 먹는 재미 있었어요 달아서 연유 필요없을 달더라구요 빙수 먹고 부르지 않았는데 토핑 넣어주셔서 런가 배불러요 커피콩 바삭 촉촉 왜케 부드럽죠 감탄 먹었 니당 비싸요 시켜 먹을게요 나게 외국인 리뷰 쓰기 힘들지만 드셨어요 빙수 잇게 늦은 갑자기 먹고싶 대서 딸기 우유 금단 딸기 듬뿍 들어있어 좋았습니다 초코 라떼 진하고 맛있네요 갑자기 시원한 빙수 땡겨서 우연 않게 발견 시켜 먹었는디 맛있어서 미니 아이스팩 오고 서늘한 급작 빙수 계속 땡겨서 먹내요 딸빙 굿굿  처음 먹는데 상태 좋고 맛있네요 연유 추가 필요한  참고 사진 녹은 아니고 뿌려서 그래용 놀라 추가 드세요 제발 커피 네욤 브리또 모르겟고 적은 건지 상자 건지 빈약하네요 상자 포장 는지 모르겟네요 상자 비어 잇음 다시는 할것 같내요 커피 무난 맛있어 아아 얼음 녹게 커피 얼음 보내주시고 좋네욤 사장 마음씨 예쁘신 리뷰 댓글 일일이 보시면서 답변 해주시고 메모 지에 손글씨 써주시고 과일 청포도 좋아하는데 일로 해주시 재료 빈공간 가득 예쁘게 올려주시고 빙달 기지점 좋아욤 와서 좋았어요 맛있더라구요 우유 얼음 자체 부드럽고 먹은 언니 인생 빙수 라면 칭찬 딸기 냉동 맛있죠 존맛 연유 모르고 전화 드리니 챙겨주시고 업체 쓰시는지 모르겠지만 하시는 사장 친절해서 더욱 먹은 오레오 케이크 번창 하세요 상큼 맛있는데 소스 레이크 챙겨주셔서 치즈 케익 좋아하는데 맛있더라고요 그거 디저트 만들어주세요 늦은 빠르고 인절미 콩가루 빙수 고소하니 양도 많고 연유 추가 뿌려 먹으니 행복한 허니 버터 인절미 토스트 카라멜 마카롱 맛있는 빙수 선사 해주신 사장 요리사 분과 라이더 감사 드립니다 빠른 아는 지인 팥빙수 드시고 싶다하여 해외 기요 통해 시켜 봤네요 사진 지인 보내주셨습니다 지인 무더위 팥빙수 드시고 싶었는데 맛있었다고 하시더라구요 한가지 아쉬운 우유 빙수 비해 토핑들 적어서 리뷰 남기셨길래 추가 이럴 알았으면 리뷰 남긴 서비스 주신다는 연유 추가 추가 할껄 그랬나 봐요 해봐야겠어요 유추 가로 달았지만 지인 드셨다고 블루베리 딸기 없었지만 청포도 빙수 맛있었다 달달 하니 스트레스 풀리는 나고 포장 좋고 서비스 좋고 듬당 요청 사항 들어주시고 빙수 맛있어용 얼음 연유 부어 먹었는데 우울했던 기분 다날 운영 해주세요 존맛 달라 누르고 기다리셔서 당황 했지만 맛있었음 빙수 맛집 빙달 올여름 빙달 먹을 겁니당 꼼꼼한 포장 넉넉한 검증 고요 와서 오오 잇는 빙수 부탁드려 먹자마자 뭔가 갈증 내려가는거 같아서  기사 귀신 같으 신분 이군 오토바이 소리 들렸는데 요청 사항 소리 왔다가셨습니다 유미 포함 이라기에 아쉬운데로 우유 시켰는데 연유 서비스 해주시 빙수 아쉽게도 사진 맛깔나게 찍는 모르네요 빠르고 연유 서비스 주셔서 달달 하니 좋았어요 소스 나눠서 뿌리 메모 내주신것도 감동 인절미 빙수 성공해서 빙수 빙달 시켜 먹기 두번째 딸바 빙수 거든여 두번째 대성공 빙수 좋아하고 과일 좋아하는데 과일 빙수 먹어요 왜냐면 냉동 과일 쓰는 경우 대부분 과일 빙수 나오는 과일 단맛 신맛 과일 고유 단맛 인위 연유 단맛 인절미 빙수 먹는데 나름 딸바 빙수 도전 거든여 냉동 좋앗고 신선한 먹을수 딸바 연유 않게 즐길수있어서 좋앗어요 빠름 양도 적당하고 예상 빨랐어요 자주 사먹을 같네요 번창 하세요 빙달 우유 빙수  주말 처음 시켜 먹고 맛있어서 토일 이틀 연속 시켜 먹고 시켜 빙수 하시는 분도 친절하고 포장 깔끔하고 눈꽃 빙수 자체 딸바 빙수 딸바 소스 좋아용 빙수 귀신 여름 되면 빙수 기본 이면 잇어도 먹게되 신규 걱정 는데 잇어서 먹으면서 리뷰 써요 원래 먹으면서 써용 토핑재료 담아서 취향 맞게 덜어 먹으면 되니까 별거 아닌거 같아도 차이구요 포장 상태 좋앗어여 출발 걸린 그거 아쉬 빙수 기다릴줄 알앗 먹을 챙갸 주세용 빠르구 잇어요 동대문 하다가 열려있어서 충무로 해봤는데 빠르고 좋네요 동대문 치즈케이크 느낌 티라미슈 서비스 감사해요 딸기 신선하고 양도 여러 이서 먹었는데 사장 센스 있어요 새벽 빙수 먹을수 있다니 퀄리티맛 훌륭했어요 감사해요,13:00 - 01:00,10000,서울 중구 충무로3가 28-5 2층,딸기슈~빙수（연유 미포함）,https://images.deliveryhero.io/image/yogiyo/PARTNER_FR_IMG/%EB%B9%99%EB%8B%AC/2019-09-09/%EC%A0%9C%ED%9C%B4FR_20190903_%EB%B9%99%EB%8B%AC_%EB%94%B8%EA%B8%B0%EC%8A%88_1080x640.jpg?width=384&height=273&quality=100
538,이디야커피-을지로3가점,좋고 빠르고 쿠키 메모 이른 추운 와주셔서 감사해요 사진 따뜻한 아메리카노 깜빡 찍었네요 호떡 서비스 감사용 빠르고 맛있네용 시원하게 마셨습니다 빠르고 친절하세요 딸기 라떼 최고 최고 빠르로 아주 마셨습니다 커피 처음 시키는데 포장 와서 좋습니다 새해 커피 마셨어요 서비스 새해 받으세요  마셨습니다 포장 깔끔하고 좋습니다 예상 왔습니다 왔구 사장 친절하셔요 추천 합니당 빠르게 왔고 친절해서 되네요 사진 먹은 그렇네요 커피 음료 식지말라고 처리 점도 섬세하고 배려 느낄수 번창 하세요 요청 사항 들어주시고 포장 꼼꼼하고 커피 최고 치즈 케익 쿠키 먹을게요 빨대 누락 됬어요 다행히 여분 챙겨주세요 화이팅 요청 사항 들어주시고 예상 와서 빠르고 잇어요 서비스 과자 잘먹엇어 친절하고 어려울 시기 센스 되는거 커피 맛있었고 호떡 시켰는데 서비스 과자 코로나 풀리고는 매장 가서도 먹을게요 친절하셨어요 서비스 주시 배려 보였 니당 기분 좋아지는 이었네요 늦은 이었는데 정성스런 하트 서비스 쿠키 감사해요 빠르고 포장 상태 좋은데 여름 아니고 겨울 얼음 담아주셨는지 음료 흐려져서 별로 였어요 녹은게 왔고 음료 밀봉 있었어요 서비스 쿠키 먹겠습니다 대량 하여도 포장 이쁘게 해주시 빠르게 해주셔서 이용 하겠습니다 빨라요 재택근무 줄기 깔끔히 이른 시켜주셨어요 커피 출근 아침 요청 드렸는데 꼼꼼하게 포장 갖다주시고 귀여운 메시지 선물 덕분 기분 좋게 근무 할수 있었습니다,07:30 - 00:00,10000,서울 중구 저동2가 78 비즈센터 1층 102호,ICED 카페 아메리카노,https://images.deliveryhero.io/image/yogiyo/PARTNER_FR_IMG/%EC%9D%B4%EB%94%94%EC%95%BC%EC%BB%A4%ED%94%BC/2018-08-03/%EC%A0%9C%ED%9C%B4fr_20180802_%EC%9D%B4%EB%94%94%EC%95%BC%EC%BB%A4%ED%94%BC_iced%EC%B9%B4%ED%8E%98%EC%95%84%EB%A9%94%EB%A6%AC%EC%B9%B4%EB%85%B8_1080x640.jpg?width=384&height=273&quality=100
542,소풍뽕잎김밥,참치 김치 김밥 떡볶이 있으면 좋겠어요 괜찮게 무난 고소한 첨가 되었으면 좋겠다는 개인 특별하게 맛있거나 그러진 않아요 무난 들이었습니다 최고 최고 양도 많구 최고 시켜 먹을게요 카레 부족해서 아쉬웠습니다 시켜 먹을게요 치즈 김치 최고 시킬께요 사장 양도 최고,10:00 - 19:30,10000,서울특별시 종로구 관수동 4-1 금용빌딩 금용빌딩,뽕잎야채김밥,https://images.deliveryhero.io/image/yogiyo/PHOTOGRAPHER_IMG/OD/28377_menu_991406.jpg?width=384&height=273&quality=100
546,무봉리토종순대국-충정로점,반찬 처음 시켜 봤는데 맛있네여 빠르고 좋은데 아쉽네요 요기 대국 맛집 먹었 미다 시켰는데 일반 왔어요 김치 깍두기 썰어주시지 우거지 갈비탕 잡뼈 잡채 잔뜩 들어서 국물 잡아먹고 김치 배추 양넴 묻혀서 순대 국도 입맛 아니였어요 대국 대국 왔네요 다대기 풀어 정확했고 깔끔하고 양도 넉넉하게 보내주셨네요 양도 넉넉하고 요청 사항 챙겨주셔서 정보 제대로 읽어서 김치 깍두기 와서 불편했지만 읽고 김치 잘라다고 요청 할게요 양파 부추 쌈장 요청 해야겠어요   무척 빠르네요 따뜻하고 대국 대국 무봉 리순 대국 해장국 뭔가 업체 비교 하는건 아니지만 고기 먹다 먹는 경우 허다 여기는 일부러 추가 내고 대자 시켰는데 부서져서 떨어지고 해장국 대자 나온 사진 나온 개선 시급하네요 대국 해장국 먹고있음 대국 빠르고 양도 괜찮고 사장 김치 박지 잘라 달라 요청 드렸더니 잘라주셔서 편하고 나름 괜찮았어요 국물 시레기 맛있네요 고기 이아 양도 많고 김치 주시 좋겠네요 영하 도의 왔고 김치 기도 대박 대국 해장국 둘다 만족  맛있었고 빠른 큰거 시켰는데 고기 적네요 작은 들어있네 군대 아니고 고기 세면 먹은 후회됨 고기 누린내가 심하네요 믿고 먹는 먹다가 처음 시켜 먹었는데 대국 작은거 기분 파랑 다데기 추가 요청 해야겠어요 느렸지만 빨랐습니다 아아 사이즈 확실히 적긴 적네요 당면 대만 많고 있었습니다 김치 박지 맛있구요 다대기 고추 요청 드렸는데 넉넉하게 넣어주셔서 순대 개인 호불호 갈리는 음식 드린 죄송하게 분식집 길거리 포장마차 나오는 순대 아니라서 텁텁 느낌 강하더라구요 불구 먹었으니 긍정 하셔도 같습니다 시켜 먹을 만원 특대 적어요 대가 대부분 내장 적네요 이전 특대 든든히 먹었는데 국물 느낌 마싯엇습니 순대 전골 시켰는데 많고 맛있어용 안주 최고 빠르고 양도 많아요 입맛 맞게 먹을 있도록 다데기 새우젓 와요 청양고추 요청 사항 기재 주셔서 좋았어요 박지 김치 짐하게 주시네요 불리 필요할까 매장 종종 는데 된다니 사장 바뀌어도 박지 그대로 신기 했었는데 사진 미처 남겼지만 할게요 사진 퀄리티 아닙니다 처음 시켜 봅니다 강하지 않아 빠르고 김치  많고 특급 식당가 먹는 해장국 비해 고기 우거지 적음 만족 겨울 뜨끈한 국밥 그릇 하니 든든하네요 대국 매웠고 무난 해장 하려  존맛  당연한것이지요 맛있어도 빠르고 양도 많아요 받았습니다 매장 빠릅니다 매장 먹던 양도 많고 빠르고 좋네요 주민 대국 가봤지만 무봉 리가 나아요 양도 주시 사장 친절하셔서 매장 종종 시구 시켜 봤는데 비계 많고 줘서 실망 스러웠는데 무봉리 양도 좋구 박지 맛있구요 최애 대국 입니당 빠르고 전체 먹을 만해 큰을 시켰는데 일반 와서 황당하긴 배고파서 아쉬운 치명 단점 있네요 장점 부족하지 않은 준수 신속한 맛있는 섞박지 단점 아쉬운 배추김치 섞박지 덩이 있었으면 맛보기 순대 순대 당면 순대 치명 단점 토종 대국 간판 무색 대국 순대 토종 대가 섞여 있으며 비율 토종 대국 순대 들어갔으면 빠르고 좋네요 자주 할께요 맛남 만족스러 김치 맛없음 나머지 맛남 깜짝 놀랐어요 박지 넉넉히 챙겨 주심 좋았을텐데 빠르고 김치 주셨어요 순대 고기 양도 괜찮은데 국물 진하 다기 담백하네요 포장 커팅할수 조그만 있음 좋겠다는 리뷰 봤었는데 왔더라구요 사장 리뷰 반영 하시는거 같네요 요청 사항 잇어서 전화 문의 드렸는데 메모 기재 해달라고 하셨지만 메모 읽으 신건 박지 잘라 달라 적어야 한다해 요청 사항 외부 먹는다고 적었는데 잘라주셔서 먹기 힘들었어요 금방 식어서 그런지 뚝배기 따듯 먹으면 맛있을거 박지 맛있긴 먹기 힘들 던거 빼구요 해장국 빠르고 잘먹엇습니 좋고 먹고있어요 대국 양도 든든하고 김치 좋고 친절하시네요 빠르고 해주신 친절해요 있어요 사장 친절하신 느낌 국물 깔끔하고 김치 양도 주시 좋앗어요 먹니라 사진 깜빡 직접 먹는것과 용기 비닐 자르는 조그만 들어 있다면 더욱 좋았을것 먹었네요 좋고 양도 좋은데 잘게 부서져서 먹는게 불편했습니다 양도 많은데 대국 들어있는 파가 오래되 보여 찜찜했어요 새로 넣은 파가 끓인 파던데 그랬습니다 먹구있어요 처음 시켜 포장 깔끔하고 요청 사항 시킨 청양고추 다데기 가득 주셨어요 깔끔하고 비린내도 냄새 안나 담백하니 맛있네요 대국 무봉리 음식물 버리기 번거롭고 아까워서 박지 대국 보내 달라 메모 요청 보내주셨어요 읽지도 성의 보내는 곳도 있던데 챙겨 보내주셔서  회사 자주 갔던 되길래 후다닥 시켜 봤어요 양도 많아서 불리 빠르네요 우거지 갈비탕 국물 우거지 완벽합니다 김치 맛있고요 사장 우거지 갈비탕 곱빼기 갈비 거만 오는거는 고기 붙어있고요 우거지 갈비 맛탕 갈비 첨가 뭔가 몇번 시켜 먹겠지만 갈비 이건 아니네요,10:00 - 23:00,10000,서울 중구 중림동 200 중림동 삼성 사이버 빌리지 상가 2동 109호,토종순대국,https://images.deliveryhero.io/image/yogiyo/REST_OWN_IMG/%EC%84%9C%EC%9A%B8/%EC%84%9C%EC%9A%B8%EC%A4%91%EA%B5%AC/451618_%EB%AC%B4%EB%B4%89%EB%A6%AC%ED%86%A0%EC%A2%85%EC%88%9C%EB%8C%80%EA%B5%AD-%EC%B6%A9%EC%A0%95%EB%A1%9C%EC%A0%90/%EC%97%85%EC%B2%B4%EC%9E%90%EC%B2%B4_20200527_451618_%EB%AC%B4%EB%B4%89%EB%A6%AC%ED%86%A0%EC%A2%85%EC%88%9C%EB%8C%80%EA%B5%AD-%EC%B6%A9%EC%A0%95%EB%A1%9C%EC%A0%90_%ED%86%A0%EC%A2%85%EC%88%9C%EB%8C%80%EA%B5%AD_1080x640.jpg?width=384&height=273&quality=100
550,긴자료코-대학로점,  양도 많고 괜찮 많고 종종 시킬듯 구구구 두우 많고 나용 최고촤  빠르고 돈까스 존맛 돈까스 덩이 오는데 바삭 살아있어요 소스 잔뜩 머금 촉촉 부들해서 가지 식감 즐길 있었습니다 굿굿 맛있네요 소스 돈까스 좋습니다 튀김 얇고 전반 간이 약해서 좋았습니다 인분 먹어도 소스 독특해서 고급스럽고 참신합니다 처음 보는데 단골 느낌 드네 많고 평균 괜찮아요 돈가스 실함 튀김 두껍지 고기 채우고 있고 포만 소스 맛남 추억 양식 오스 세트 새우 튀김 감자 고로케 추가 양파 크림소스 뿌려져서 오는데 어울림 새우 튀김 나쁘지 감자 고로케 아주 났음 샐러드 상추 드레싱 살짝 뿌리 토마토 작은 조각 괜찮은데 샐러드 자체 양은 살짝 아쉬움 부담 맛있음 시켜 먹을 예정 보이는것 많습니다 소스 들어가는 이유 친절합니다 고기 많고 처음 시켜 먹었는데 많아요 돈가스 원래 소스 돈까스 먹는거 별로 좋아하는데 집은 돈가스 소스 부드럽고 느끼하지 않아요 존맛 소스 양도 빠르네요 소스 맛있었는데 돈까스 무심했어요 돈까스 맛있네요 장국도 맛있어 시켜 먹겠습니다  만족스러워요 양도 많고 최고 돈까스 튀김 바삭 소스 예술 맛있는 찾아서 기분 자주 시켜 먹을 겨자 조합 최고 버세 사장 돈까스 돈까스 고로케 맛있네요 돈까스 많아서 먹을 였어요 걸리면 눅눅해지니 소스 오는 좋을  데미 란스 돈까스 저번 익스 프레 시켰을 걸리길래 살짝 별로 오길래 기분 좋네요 가까워서 그런지 따뜻하게 먹을 있네요 감사함 데미 그라스 돈까스 먹었었는데 갑자기 카레 먹고 싶어서 카레 돈까스 시켰는데 양도 많고 맛있네요 튀김 저녁 늦게 시켰는데도 양도 충분합니다 존맛 좋길래 시켜 봤는데 괜찮네요 소스 주신것도 감사해요 매우 매우 맛있다 자주 시켜 먹는다 최고 동시 최고 소스 먹으면  배부르게 먹기 많아요 빠른 부탁드립니다 고난 직후 원래 비벼 먹는 건가 봐요 국물 터져서 여기저기 흘렀어요 많을까봐 덜어주시려고 가봐요 익스 프레 그거 예상 느렸고 상태 엉망 빡쳐서 버렸지 잘못 모르겠어요 기사 롤러코스터 태우신 건지 포장 이상한 건지 모르겠어요 봐서 모르겠지만 맛있다고 하니까 양도 많고 소스 주셔서 감사 드려요 돈까스 촉촉하고 부드러웠어요 시켜 먹을게 맛있다고 소문나서 시켜 봤어요 맛있네요  맛있어서 생각남 맛있어서 이틀 시킴 양도 많고 빠르게 해주셔서 따듯 먹을 있었습니다 빠른 좋았는데 소스 흘리고 난리 났네요 흘리는거라면 상관 타입 오면 입맛 좋을까요 요청 사항 가볍게 무시 하셨고 무난 기분 별로 좋지 않네요 이러면 맛있다 딱히 사고 싶지는 않습니다 양도 좋았어요 튀김 별미 전화 드려 자초지종 설명 드리며 수란 했고 봤으나 수란 처음 본다고 말씀드렸더니 원래 수란 이러며 문제 전혀 없다고 말씀 하시여 사진 보시 소리 할거 말씀드렸더니 문제 있었으면 아예 나갔을거 문제 있으면 보통 만든다 말씀 하시여 얘기 안통 하실거 같아 끊었습니다 사장 마니버세 오야꼬동 있었어요 참고 하시라고 적습니다 빠르고 소스 담아 달라 요청 뿌려져 온것 언짢을 뻔했는데 보니 맛있어서 풀렸어요 소스 맛있네용 감자 크로켓 맛있었고 새우도 돈까스 먹었음 맛있어서 자주 먹습니다 샐러드 드레싱 깜빡 하셨나 봐요 돈까스 맛있게잘 한지 되었습니다 소스 부탁 부어져서 왔네요 좋습니다 합격 소스 자극 지도 담백하게 맛있엇어용 요청 들어주셔서  일주일 먹는데 먹고 왔을 평소 용기 그릇 왔더라구요 그릇 좁고 깊었는데 그런지 카레 소스 불어있었습니다 그릇 까맣게 묻어있었어요 매장 평소 자주 위생 걱정 여전히 맛있었습니다만 예전 용기 나은 포장 용기 바뀐거 착각 최고  카레 아주 맛있다   자주 가는 마로니에 공원 먹은 돈까스 나은듯 좋네요 빠르고 많고 빠르고 개인 가라아게 나네요    양은 많아요 돈까스 맛있구 규동 느끼하고 달아요 연속 굿굿굿 빠르고 돈까스 맛있음 먹었는데 맛있을고 익스 프레 래서 시켰는데 걸렸네요 식어서 왔어요 아쉽 네오 맛있는데 했어욬 맛있긴 샐러드 적어서 세트 먹기 느끼했음 처음 타입 별로 먹다 보니 끊을 중독 버렸어요 빠르고 바쁘셨는지 소스 주시 감사하겠다고 적었는데 주셨더라구요 두드려 달라 가신데다가 아니고 계단 두고가셔서 몇번 나가서 확인 늦게 발견 했네요 눅눅하고 싸늘한 시체 되었습니다 눅눅한 돈까스 싫어해서 모르겠지만 소스 특이해서 나쁘지는 않은 있어요 소스 좋고 튀김 가루 바삭 하니 돈가스 겨자 살짝 발라 먹어도 훌륭해요 일부러 소스 담거 먹고 가지고있던 마늘 소스 매운 소스 봤는데 어울리는 얇게 썰려와 소스 듬뿍 담가지는 좋은데 이건 개인 차이 드시 충분 한양 깨밥 많고 인취 별하나 뺀건 가격 대비 했을 전문점 간지오래 라서 아쉬운 부분 돈가스 자체 얇게 썰어주셔서 많아 보이긴 먹다 많다는 느낌 정확해요 맛집 괜찮았지만 심하네요 김치 빼고 달라 부탁드렸는데 김치 주셨네요 요기 짐하 주셔서 돈까스 양도 넉넉해서 할게요 맛있는건 알았는데요 돈까스 소스 존맛탱 마니 부탁드렸더니 낙넉 하게주셔셔 감동 사장 덕분 먹었 음식 인품 일품 이세 부탁드린대로 소스 주셔서 요즘 긴자 료코 돈까스 빠졌습니다 가격 대비 양도 많고 음식 퀄리티 높은거 마싰어 마니 빠르고 음식 ,11:30 - 21:20,10000,서울특별시 종로구 동숭동 128-16,데미그라스돈까스,https://images.deliveryhero.io/image/yogiyo/PHOTOGRAPHER_IMG/OD/27929_menu_979120.jpg?width=384&height=273&quality=100
554,GS25-나인트리호텔점,제품 없어서 브랜드 동일한 아이템 대체 영수증 설명 해주시고 고구마 서비스 주셨어요 빠르고 서비스 케이준 치킨 샐러드 시켰는데 품절 가슴 샐러드 바꿔주셨어요 둘다 비슷한,11:00 - 23:00,10000,서울 중구 초동 72-10 1층(나인트리프리미어호텔),내맘대로 골라먹는 도시락,https://images.deliveryhero.io/image/yogiyo/PARTNER_FR_IMG/gs25/2020-12-30/%EC%A0%9C%ED%9C%B4FR_20201229_GS25_%EB%82%B4%EB%A7%98%EB%8C%80%EB%A1%9C%EA%B3%A8%EB%9D%BC%EB%A8%B9%EB%8A%94%EB%8F%84%EC%8B%9C%EB%9D%BD_1080x640.jpg?width=384&height=273&quality=100
558,샤이바나-광화문점,수란 치즈 매콤 토마토소스 취향 맞아요 포장 감동 장가 자주 먹다 속도 깜놀 좋았던  처음 봤을 가격 비해 많지는 느끼해서 그런지 적당했어요 느끼느 막고 싶을 딱인거 같고 아웃백 투움바 기대했는데 하진 않은거 묽은 느낌 나게 국물 주신건 신의한수 노답 노답 다른데 찍고 찾는걸 성질 내더라구요 나가서 이럴거면 시켰나 후회 치킨 맥앤치즈 느끼하지 고소해요 치킨 퍽퍼살 다릿살 좋았어요 치즈 좋아해서 먹었어여 쵝오 뜻밖 행운 만난 기분 맛있고요 살이 차오르는 기분 손수 적어주신 메모 바나 사랑 입니 맥앤치즈 좋아하는데 치킨 마리 맛있게잘 칠리소스 부드럽고 슬로 이용 할게요 아주 푸드 잠발라야 찔이에겐 매웠지만 해산물 들어서 좋았어요 혈관 살살 녹는,11:00 - 20:30,10000,서울 중구 태평로1가 84 파이낸스빌딩 지하1층,빅보이 칠리 스파게티,https://images.deliveryhero.io/image/yogiyo/PHOTOGRAPHER_IMG/%EC%84%9C%EC%9A%B8/%EC%84%9C%EC%9A%B8%EC%A4%91%EA%B5%AC/487457_%EC%83%A4%EC%9D%B4%EB%B0%94%EB%82%98-%EA%B4%91%ED%99%94%EB%AC%B8%EC%A0%90/DHK%EC%B4%AC%EC%98%81_20201204_487457_%EC%83%A4%EC%9D%B4%EB%B0%94%EB%82%98-%EA%B4%91%ED%99%94%EB%AC%B8%EC%A0%90_%EB%B9%85%EB%B3%B4%EC%9D%B4%EC%B9%A0%EB%A6%AC%EC%8A%A4%ED%8C%8C%EA%B2%8C%ED%8B%B0_1080x640.jpg?width=384&height=273&quality=100
562,밀&끼니,먹겠습니다 검사 먹겠습니다 검사,10:00 - 19:30,10000,서울특별시 종로구 관수동 4-1 금용빌딩 금용빌딩,참치 샌드위치,https://images.deliveryhero.io/image/yogiyo/STOCK_IMG/%EB%B6%84%EC%8B%9D%EB%94%94%EC%A0%80%ED%8A%B8/%EB%94%94%EC%A0%80%ED%8A%B8/%EC%8A%A4%ED%83%81_20190807_DHK%EC%B4%AC%EC%98%81_%EC%B0%B8%EC%B9%98%EC%83%8C%EB%93%9C%EC%9C%84%EC%B9%98_Side01_1080x640.jpg?width=384&height=273&quality=100
566,커피스니퍼,빠르고 아이스 시켰는디 빨대 주셨네요 라떼 먹는거보다 이별 시켰어요 세상 달지도 원래 커스터드 보이는데 허겁지겁 먹고 찍느라 섞여 버렸네요 존맛임 회사 영업 시켜 머것 포장 니당 커스타드 살아서 왓어 빠르고 아이스 시켰는디 빨대 주셨네요 라떼 먹는거보다 이별 시켰어요 세상 달지도 원래 커스터드 보이는데 허겁지겁 먹고 찍느라 섞여 버렸네요 존맛임 회사 영업 시켜 머것 포장 니당 커스타드 살아서 왓어 빠르고 아이스 시켰는디 빨대 주셨네요 라떼 먹는거보다 이별 시켰어요 세상 달지도 원래 커스터드 보이는데 허겁지겁 먹고 찍느라 섞여 버렸네요 존맛임 회사 영업 시켜 머것 포장 니당 커스타드 살아서 왓어,10:00 - 18:00,10000,서울특별시 중구 북창동 11-3 남양빌딩 남양빌딩,스니퍼라떼,https://images.deliveryhero.io/image/yogiyo/PHOTOGRAPHER_IMG/OD/27191_menu_942366.jpg?width=384&height=273&quality=100
