,title,review,hour,min_order,address,menu,menu_img
1189,12첩반상,처음 들어요 돼지 불고기 계란말이 깻잎 북어 무침 깍두기 도토리묵 다양하게 간도 쎄지 맛있네요 가끔 이용 될거 봤지만 깔끔하게 포장 되서 가지 맛있을꺼 반찬 바뀌나요 반찬 종류 쓰여있음 좋을 먹을만은 반찬 최고 잡채 먹고 있는데 머리카락 화나고 할거 같네요 음식점 위생 기본 아닌가요 싼것도 아니고 먹으면서 위생 따지는 잘못 건가 너무하네요 후기 머리카락 나왔다더니 시킨 잘못이네요 다시는 이용 할랍니다 깔끔하게 보내주시네요 종종 해야겠습니다 입맛 까다로운 좋아합니다 처음 시켜 봤는데 괜찮네요  나쁘지 않아요 재구매 반찬 여러가지 구매 맛있음 양도 많아요  이제야 발견 양도 먹어도 충분할듯 한가지 아쉬운거는 직장인 추가 방식 해보시면 팔릴듯 포장 뚜껑 덮지 마시고 싸주시면 좋겟어요 국물 흐르고 그럽니다 사장 먹는 반찬 제외 보내 주셨네요 반찬 깔끔하고 간도 맞고 좋네요 만족합니다 문제 한가지 있는데요 김치 젓갈 반등 한쪽 담아주세요 상하 음식 나물 잡채 한쪽 몰아주시구요 관할 애매해서요 수고 하시구요 있는데 가지 반찬 램덤 먹거나 싫어하는 반찬 있을수 아쉽네요 반찬 많아서 좋음 이상하게 안좋은 리뷰 업체 비방 달리네요 비방 없고요 팩트 남길게요 종류 무난 반찬 갓김치 머리카락 있었구요 식당 하시는데 이해 김치 갓김치 겉절이 였는데 둘다 나머지 마른 반찬 평균 식당 반찬 맛있다 싶은거 맛없는것도 그래요 가격 대비 양은 괜찮은 같네요 용기 전자렌지 가능 용기 좋네요 맛았  애둘 사는데 음식 양도 많고요 간도 쎄지 않아서 좋았어요 끼는 먹을꺼 시키고 싶어요 반찬 올지 궁금할꺼 파세요 그래요 고사리 검은색 긴실이 나왔네요 양은 인분 빠르고 반찬 다양한게 좋네요 여름 반찬 우려 되는데 여긴 그날 만든 반찬 해주니 안심 더운데 가스레인지 있어도 되니 좋네요 양도 많아 먹겠는데요 적극 추천 집밥 그리울 시켜 드세요 가지 반찬 마음 드네 사는 딱인거 김치 종류 짰어요 다른건 최고 였어요 완잔맘 들어요  요새 춥고 집밥 먹고싶어서 반찬 많아서 거뜬히 해결 있을 같네요 종종 시켜 먹을게 자취 꼭꼭 드셔 보세요 후회 원래 없나요 아쉽다 반찬 호불호 있을 반찬 들임 많아요 부모님 병원 시켰는데 진수 성찬 정갈하게 포장 왔다고 좋으하시더라구요 자취 버려서 사진 찍었는데 만족해서 리뷰 남깁니다 양도 많고 괜찮네요 특별한건 아니지만 자취 챙겨 먹기 좋네요 처음 들어요 돼지 불고기 계란말이 깻잎 북어 무침 깍두기 도토리묵 다양하게 간도 쎄지 맛있네요 가끔 이용 될거 봤지만 깔끔하게 포장 되서 가지 맛있을꺼 반찬 바뀌나요 반찬 종류 쓰여있음 좋을 먹을만은 반찬 최고 잡채 먹고 있는데 머리카락 화나고 할거 같네요 음식점 위생 기본 아닌가요 싼것도 아니고 먹으면서 위생 따지는 잘못 건가 너무하네요 후기 머리카락 나왔다더니 시킨 잘못이네요 다시는 이용 할랍니다 깔끔하게 보내주시네요 종종 해야겠습니다 입맛 까다로운 좋아합니다 처음 시켜 봤는데 괜찮네요  나쁘지 않아요 재구매 반찬 여러가지 구매 맛있음 양도 많아요  이제야 발견 양도 먹어도 충분할듯 한가지 아쉬운거는 직장인 추가 방식 해보시면 팔릴듯 포장 뚜껑 덮지 마시고 싸주시면 좋겟어요 국물 흐르고 그럽니다 사장 먹는 반찬 제외 보내 주셨네요 반찬 깔끔하고 간도 맞고 좋네요 만족합니다 문제 한가지 있는데요 김치 젓갈 반등 한쪽 담아주세요 상하 음식 나물 잡채 한쪽 몰아주시구요 관할 애매해서요 수고 하시구요 있는데 가지 반찬 램덤 먹거나 싫어하는 반찬 있을수 아쉽네요 반찬 많아서 좋음 이상하게 안좋은 리뷰 업체 비방 달리네요 비방 없고요 팩트 남길게요 종류 무난 반찬 갓김치 머리카락 있었구요 식당 하시는데 이해 김치 갓김치 겉절이 였는데 둘다 나머지 마른 반찬 평균 식당 반찬 맛있다 싶은거 맛없는것도 그래요 가격 대비 양은 괜찮은 같네요 용기 전자렌지 가능 용기 좋네요 맛았  애둘 사는데 음식 양도 많고요 간도 쎄지 않아서 좋았어요 끼는 먹을꺼 시키고 싶어요 반찬 올지 궁금할꺼 파세요 그래요 고사리 검은색 긴실이 나왔네요 양은 인분 빠르고 반찬 다양한게 좋네요 여름 반찬 우려 되는데 여긴 그날 만든 반찬 해주니 안심 더운데 가스레인지 있어도 되니 좋네요 양도 많아 먹겠는데요 적극 추천 집밥 그리울 시켜 드세요 가지 반찬 마음 드네 사는 딱인거 김치 종류 짰어요 다른건 최고 였어요 완잔맘 들어요  요새 춥고 집밥 먹고싶어서 반찬 많아서 거뜬히 해결 있을 같네요 종종 시켜 먹을게 자취 꼭꼭 드셔 보세요 후회 원래 없나요 아쉽다 반찬 호불호 있을 반찬 들임 많아요 부모님 병원 시켰는데 진수 성찬 정갈하게 포장 왔다고 좋으하시더라구요 자취 버려서 사진 찍었는데 만족해서 리뷰 남깁니다 양도 많고 괜찮네요 특별한건 아니지만 자취 챙겨 먹기 좋네요 처음 들어요 돼지 불고기 계란말이 깻잎 북어 무침 깍두기 도토리묵 다양하게 간도 쎄지 맛있네요 가끔 이용 될거 봤지만 깔끔하게 포장 되서 가지 맛있을꺼 반찬 바뀌나요 반찬 종류 쓰여있음 좋을 먹을만은 반찬 최고 잡채 먹고 있는데 머리카락 화나고 할거 같네요 음식점 위생 기본 아닌가요 싼것도 아니고 먹으면서 위생 따지는 잘못 건가 너무하네요 후기 머리카락 나왔다더니 시킨 잘못이네요 다시는 이용 할랍니다 깔끔하게 보내주시네요 종종 해야겠습니다 입맛 까다로운 좋아합니다 처음 시켜 봤는데 괜찮네요  나쁘지 않아요 재구매 반찬 여러가지 구매 맛있음 양도 많아요  이제야 발견 양도 먹어도 충분할듯 한가지 아쉬운거는 직장인 추가 방식 해보시면 팔릴듯 포장 뚜껑 덮지 마시고 싸주시면 좋겟어요 국물 흐르고 그럽니다 사장 먹는 반찬 제외 보내 주셨네요 반찬 깔끔하고 간도 맞고 좋네요 만족합니다 문제 한가지 있는데요 김치 젓갈 반등 한쪽 담아주세요 상하 음식 나물 잡채 한쪽 몰아주시구요 관할 애매해서요 수고 하시구요 있는데 가지 반찬 램덤 먹거나 싫어하는 반찬 있을수 아쉽네요 반찬 많아서 좋음 이상하게 안좋은 리뷰 업체 비방 달리네요 비방 없고요 팩트 남길게요 종류 무난 반찬 갓김치 머리카락 있었구요 식당 하시는데 이해 김치 갓김치 겉절이 였는데 둘다 나머지 마른 반찬 평균 식당 반찬 맛있다 싶은거 맛없는것도 그래요 가격 대비 양은 괜찮은 같네요 용기 전자렌지 가능 용기 좋네요 맛았  애둘 사는데 음식,13:50 - 02:00,12000,서울 중구 충무로5가 2-23 1층,12가지반찬,
1195,써브웨이-을지로입구점,있는데 아보카도 추가 된것 맞나요 보이네요 문제 포장 문제 인지 모르겠는데 스프 흘러서 왔어요 있는데 아보카도 추가 된것 맞나요 보이네요 문제 포장 문제 인지 모르겠는데 스프 흘러서 왔어요,13:30 - 18:00,12000,서울 중구 남대문로1가 22-10,베지 30cm 세트,https://images.deliveryhero.io/image/yogiyo/PARTNER_FR_IMG/%EC%8D%A8%EB%B8%8C%EC%9B%A8%EC%9D%B4/2019-11-08/%EC%A0%9C%ED%9C%B4FR_20191108_%EC%8D%A8%EB%B8%8C%EC%9B%A8%EC%9D%B4_%EB%B2%A0%EC%A7%80%EB%94%9C%EB%9D%BC%EC%9D%B4%ED%8A%B830cm%EC%84%B8%ED%8A%B8_1080x640.jpg?width=384&height=273&quality=100
1199,국민우동-관수점,빠르고 가격 대비 양도 적당하고 김치 빠르고 가격 대비 양도 적당하고 김치 빠르고 가격 대비 양도 적당하고 김치,요기요 서비스 준비중,12000,서울 종로구 관수동 145-1 1층,비빔국수,https://images.deliveryhero.io/image/yogiyo/REST_OWN_IMG/%EC%84%9C%EC%9A%B8/%EC%84%9C%EC%9A%B8%EC%A2%85%EB%A1%9C%EA%B5%AC/481891_%EA%B5%AD%EB%AF%BC%EC%9A%B0%EB%8F%99-%EA%B4%80%EC%88%98%EC%A0%90/%EC%97%85%EC%B2%B4%EC%9E%90%EC%B2%B4_20200928_481891_%EA%B5%AD%EB%AF%BC%EC%9A%B0%EB%8F%99-%EA%B4%80%EC%88%98%EC%A0%90_%EB%B9%84%EB%B9%94%EA%B5%AD%EC%88%98_1080x640.jpg?width=384&height=273&quality=100
1205,민지네분식,아침 식이 조절 보니 점심때 되면 탄수화물 땡깁니다 민지 떡볶이 힐링 김밥 채웠네요 오뎅 국물 오뎅 서비스 감사 드립니다 신랑 꼬치 어렸을 먹었을 비싸다네요 세트 있었으면 좋겠어요 하겠습니다 떡볶이 간이 배고 어렸을 먹었던 떡볶이 거리 되시는 라볶이 떡볶이 나은 꼬마 김밥 사이즈 귀엽고 맛있어서 하구요 튀김 오징어 튀김 좋아해서 해봤습니다 탄수화물 천지 샐러드 맛있는 저녁 할께요 꼬치 꼬치 좋아하는 이었어요 굳이 말씀드리자면 오뎅 살짝 짰어요 귯이 양도 많아요 후기 좋아서 시켜 좋고 깔끔한데 라볶이 불어 왔어요 밀떡 옛날 떡볶이 나서 좋은데 라면 쉽게 불다 보니 떡볶이 시킬 같습니다 서비스 국물 어묵 좋았습니다 아마 신경 써주신 떡뽁 입맛 맞아요 맛있어서 먹게 되네요 사진 깜박 먹은 옛날 초등학교 다닐 동네 먹던 포토 리뷰 일까 기대하면서 맛있어서 치웠어요 양도 주시 서비스 오뎅 국물 챙겨주셔서 기분 좋았는지 몰라요 밀떡 보려구요 추운 저녁 예상 쪼금 늦었지만 음식 맛있어서 잊게 하겠습니다 빠르고 직접 가거나 어플 자주 시켰는데 기요 처음 하네용 기사 친절하셨구요 내장 부탁드렸는데 요청 사항 들어주신 사장 주먹 변함 최애 꼬치 순대 꼬치 친절한 사장 좋았고 떡볶이 꼬치 떡볶이 인분 시켰는데 인분 온거 같네요 최근 먹은 분식 저렴하고 많네요 사장 흡족 좋았습니다 이스트 깔끔한 포장 깜짝 놀랐어요 김밥 속도 알차고 오뎅 국물 부탁드렸더니 저만큼 주셨어요 기사 곳도 하시고 오신거 초과 부분 아쉬웠습니다 양도 많고 간도 적당해서 좋았어요 떡뽁이 먹고 싶고 라면 먹고싶고 짜장 먹고 싶고 제대로 오뎅 먹었 니당 튀김 튀김 별로 튀김 두꺼워요 싱거워요 먹는거지만 빠르고 완벽한 맛있어서 먹었네요 음식 양도 넉넉해요 와서 좋았어요 번창 하세요 빠르고 친절하시구요 좋고  김밥 먹을만 했음 오징어 튀김 범벅 김말이 간하나도 안됨 달걀 망원 시장 팔던 튀김 알았더니 삶은 계란 사진 튀긴듯이 튀김 끼워 팔다니 라다 참는다 버리고 입맛 버리고 순대볶음 시켰는데 먹어요 맛있다 빠르고 깔끔한 포장 양도 많고 볶기 신세계 오뎅 감사해요 맛있게잘 먹느라 사진 찍었지만 최고 순대 아쉬웠어요 다른건 좋았습니다 빠르구요 원래 자주 먹었는데 양도 만원 행복 요기 멤버 사용 보니 천원 할인 쿠폰 적용 하니 만원 내고 행복 누렸네요 신랑 야근 한다고 먹으려고 많아서 떡볶이 야근 돌아온 신랑 거들었네요 꼬치 서비스 감사하구요 시킨 최고 직접 가서도 리뷰 이벤트 없었는대 꼬치 챙겨주셨네요 심쿵 떡볶이 국물 달라 하였는대 요청 사항 학교 분식집 생각나는 비쥬 번창 하세요 하려고 자꾸 오픈 미뤄져서 배고파서 시켰더니 생각나는 민지 리뷰 꼬치 맛있는데 어릴 비싸졌다고 했더니 서비스 주셔서 진상 천원 세트 있으면 좋겠다고 지난 후기 천원 썼었네요 꼬치 년전 어린시절 떡볶이 강추 꼬마 김밥 시키 고픈데 서당 되는거죠 튀김 살짝 눅눅했지만 칭찬 자가 모자라 꼬마 김밥 강력 추천 아침 식이 조절 보니 점심때 되면 탄수화물 땡깁니다 민지 떡볶이 힐링 김밥 채웠네요 오뎅 국물 오뎅 서비스 감사 드립니다 신랑 꼬치 어렸을 먹었을 비싸다네요 세트 있었으면 좋겠어요 하겠습니다 떡볶이 간이 배고 어렸을 먹었던 떡볶이 거리 되시는 라볶이 떡볶이 나은 꼬마 김밥 사이즈 귀엽고 맛있어서 하구요 튀김 오징어 튀김 좋아해서 해봤습니다 탄수화물 천지 샐러드 맛있는 저녁 할께요 꼬치 꼬치 좋아하는 이었어요 굳이 말씀드리자면 오뎅 살짝 짰어요 귯이 양도 많아요 후기 좋아서 시켜 좋고 깔끔한데 라볶이 불어 왔어요 밀떡 옛날 떡볶이 나서 좋은데 라면 쉽게 불다 보니 떡볶이 시킬 같습니다 서비스 국물 어묵 좋았습니다 아마 신경 써주신 떡뽁 입맛 맞아요 맛있어서 먹게 되네요 사진 깜박 먹은 옛날 초등학교 다닐 동네 먹던 포토 리뷰 일까 기대하면서 맛있어서 치웠어요 양도 주시 서비스 오뎅 국물 챙겨주셔서 기분 좋았는지 몰라요 밀떡 보려구요 추운 저녁 예상 쪼금 늦었지만 음식 맛있어서 잊게 하겠습니다 빠르고 직접 가거나 어플 자주 시켰는데 기요 처음 하네용 기사 친절하셨구요 내장 부탁드렸는데 요청 사항 들어주신 사장 주먹 변함 최애 꼬치 순대 꼬치 친절한 사장 좋았고 떡볶이 꼬치 떡볶이 인분 시켰는데 인분 온거 같네요 최근 먹은 분식 저렴하고 많네요 사장 흡족 좋았습니다 이스트 깔끔한 포장 깜짝 놀랐어요 김밥 속도 알차고 오뎅 국물 부탁드렸더니 저만큼 주셨어요 기사 곳도 하시고 오신거 초과 부분 아쉬웠습니다 양도 많고 간도 적당해서 좋았어요 떡뽁이 먹고 싶고 라면 먹고싶고 짜장 먹고 싶고 제대로 오뎅 먹었 니당 튀김 튀김 별로 튀김 두꺼워요 싱거워요 먹는거지만 빠르고 완벽한 맛있어서 먹었네요 음식 양도 넉넉해요 와서 좋았어요 번창 하세요 빠르고 친절하시구요 좋고  김밥 먹을만 했음 오징어 튀김 범벅 김말이 간하나도 안됨 달걀 망원 시장 팔던 튀김 알았더니 삶은 계란 사진 튀긴듯이 튀김 끼워 팔다니 라다 참는다 버리고 입맛 버리고 순대볶음 시켰는데 먹어요 맛있다 빠르고 깔끔한 포장 양도 많고 볶기 신세계 오뎅 감사해요 맛있게잘 먹느라 사진 찍었지만 최고 순대 아쉬웠어요 다른건 좋았습니다 빠르구요 원래 자주 먹었는데,요기요 서비스 준비중,12000,서울 중구 신당동 364-11 1층,쫄라볶이（쫄면＋라면＋떡볶이＋오뎅＋짜장＋고추장）,
1209,스무디킹-서울역사점,빠르고 스무디킹 보네요,요기요 서비스 준비중,12000,서울 중구 봉래동2가 122-11 경부고속철도서울민자역사 지상1층,스트로베리 익스트림,https://images.deliveryhero.io/image/yogiyo/NON_PARTNER_IMG/%5BOD%5D%20NON_PARTNER_IMG/%EC%8A%A4%EB%AC%B4%EB%94%94%ED%82%B9/%EC%A0%9C%ED%9C%B4FR_20180420_%EC%8A%A4%EB%AC%B4%EB%94%94%ED%82%B9_%EC%8A%A4%ED%8A%B8%EB%A1%9C%EB%B2%A0%EB%A6%AC%EC%9D%B5%EC%8A%A4%ED%8A%B8%EB%A6%BC_1080x640.jpg?width=384&height=273&quality=100
1211,뚜레쥬르-신당역점,빠르고 서비스 주시 친절한 쪽지 추천 신당 뚜레쥬르 최고 빵맛 최고 빠르고 뚜레쥬르 신당 직원 받았습니다 행복한 하루 보내세요 시킨지 도착 빠른 감사 드리고 빠르고 동네 가까운 뚜레쥬르 없어서 시켜 먹으니  고구마 했네요 고구마 나네요 식구 먹다가 하다고 난리 났네요 조치 해주세요 토스트 일찍 왔구 커피 기대 먹은 바닐라 라떼 손꼽 시험 기간 야식 빠르고 맛있는데 느린게 아쉽네요  건강 브레드 그렇고 치즈 방앗간 쫄깃 크림 치즈 듬뿍 나구요 호두 연유 바게트 처음 먹는데 안질 기구 호두 씹히구 부드러운 크림 들었구 담백해서 전체 뚜레쥬르 가격 프랜차이즈 탑인듯 중간 기사 바뀌셔서 늦었는데 전화 친절히 안내 해주셨어요 뚜레쥬르 최고 늦었어요 케익 사진 식빵 나서 반해요 초콜릿 종류 좋아하는데 없어서 아쉽 기는 하네요 아아 먹으니 초도 챙겨주셨어요 감사해여 먹었네요  보내놓고 닫으면 지나는건 이해 는데 늦을거 같으면 애기 해주던가 됫다 닫으면 시킨 바보 되지 않겠나요 지나고 걸려서 왔어요 마카롱 크기 가격 사진 시키지 않으시길 추천 좋습니다 샌드위치 살짝 매콤 빨라요 쿠키 빠르고 맛있네요 케이크 실제 이쁘구 서비스 크림 치즈 페스 츄리 감사해요 예상 빨랐어요 박스 이뻐서 빨대 휴지 챙겨주시고 이센스 늦긴 했지만 미리 전화 주셔셔 괜찮았어요 맛있네요 자주 할께요 괜찮았어요 꼼꼼한 포장 감사해요 나게 빠르고 빠르고 빵맛 좋습니다 기오 뚜레쥬르 생겨서 기뻐요,요기요 서비스 준비중,12000,서울 중구 신당동 100-2,치즈방앗간（3개）,https://images.deliveryhero.io/image/yogiyo/PARTNER_FR_IMG/%EB%9A%9C%EB%A0%88%EC%A5%AC%EB%A5%B4/2020-01-08/%EC%A0%9C%ED%9C%B4FR_20200107_%EB%9A%9C%EB%A0%88%EC%A5%AC%EB%A5%B4_%EC%B9%98%EC%A6%88%EB%B0%A9%EC%95%97%EA%B0%84-3%EA%B0%9C_1080x640.jpg?width=384&height=273&quality=100
1213,이디야커피-종로3가점,  느리지만 서비스 좋았습니다 왔습니다 빠른 감사 드려요 친절하구 빠르고 카페 처음 해보는데 괜찮네요,11:30 - 19:30,12000,서울 종로구 종로3가 124,ICED 바닐라 라떼,https://images.deliveryhero.io/image/yogiyo/PARTNER_FR_IMG/%EC%9D%B4%EB%94%94%EC%95%BC%EC%BB%A4%ED%94%BC/2018-08-03/%EC%A0%9C%ED%9C%B4fr_20180802_%EC%9D%B4%EB%94%94%EC%95%BC%EC%BB%A4%ED%94%BC_iced%EB%B0%94%EB%8B%90%EB%9D%BC%EB%9D%BC%EB%96%BC_1080x640.jpg?width=384&height=273&quality=100
1215,스무디킹-삼청동점,빠르고 좋은데 아몬드 요거트 직접 넣어서 보내주실 있어요 기존 별도 포장 부탁드려요,요기요 서비스 준비중,12000,서울 종로구 화동 61 안송빌딩 1층,스트로베리 익스트림,https://images.deliveryhero.io/image/yogiyo/NON_PARTNER_IMG/%5BOD%5D%20NON_PARTNER_IMG/%EC%8A%A4%EB%AC%B4%EB%94%94%ED%82%B9/%EC%A0%9C%ED%9C%B4FR_20200427_%EC%8A%A4%EB%AC%B4%EB%94%94%ED%82%B9_%EC%8A%A4%ED%8A%B8%EB%A1%9C%EB%B2%A0%EB%A6%AC%EC%9D%B5%EC%8A%A4%ED%8A%B8%EB%A6%BC_1080x640.jpg?width=384&height=273&quality=100
1217,뚜레쥬르-숙대입구점,빠르고 서비스 빨라요 먹을게요 빠르고 빠르고 맛잇엇어 왔었고 비닐 종이가방 크고 많았는데 카페 카야 번은 부드럽고 맛있었는데 먹다가 갑자기 이상해졌고 옥수수범벅 소보 생겼고 니콘 씹히고 있는데 크림 같은게 기름 지고 우유 괜찮았고 모닝 샌드위치 감자 보통 이었고 계란 맛있었고 단호 박은별 였고 에그타르트 맛있지만 기름 지고 축축했고 치즈 당근 케이크 없어서 티라미수 타르트 초코 케잌 줬었는데 티라미수 타르트 는달 부드럽고 맛있었고나 진아 직안 봤음 적네요 샌드위치 먹었고 서비스 슈도 감사하게  빠르고 좋았어요 숙대 서비스 우유 넣어주셨는데 감동 가장 맛있었던 감사해요 좋은 하루 되세요 빨라요 놀랬어요 서비스 주신것도 먹을게요 막었습니다 귀여워서 버렸어요 서비스 베이비 친절한 메모 한결같은 서비스 감동 빨라요 서비스 주시 감사하고 자주 용할께요 맛있어용 아들 맛있다고 달라 하네요 좋았어요 케이크 나게 사장 손글씨 감동 입니당 커피 포장 해주셔서 마셨습니다 비오는 날인데도 빨랐어요 서비스 파세요 만족합니다 빠른 서비스 나쁘지 않은 괜찮았어요 빠르도 베이비 서비스 베이비 추가 해야겠어용 자주 시킬게 서비스 포스트잇 써서 보내주셨는데 귀여워요 먹었 니당 나고 서비스 주시 서비스 주시 이쁘게 메모 붙혀 주시 추강 가끔 방문 매장 깔끔하고 다양하고 알바생 친절하셨는데 귀여운 쪽지 서비스 주시 뚜레쥬르 예상 일찍 오시 포장 상태 베리 커피 흘리게끔 고로케 사라다 서비스 고객 서비스 어플 행사 없는게 아쉽네요 재구매 숙대 뜨레쥬르 아주 서비스 감사 드려요 먹겠습니다 자주 이용 할게요 베이비 슈도 굿굿 짭쪼름 우유 귀여운 그림 감사해요 서비스 베이비 호두 연유 바게트 흑심 품은 맘모스 크림 치즈 독특하면서 사라다 고르케 나네요  슈도 주셔서 서비스 숙대 맛있네요 빠르고 서비스 깔끔하게 포장 되서 오고 서비스 있네요 예상 서비스 감동 하구 가요 할게요  귀엽네요 서비스 베이비 슈가 감동 이었어요 원래 근처 사먹기만 해보고 처음 서비스 귀여워서 종종 시켜 먹을 빠르고 서비스 잇게잘 샌드위치 커팅 방식 바뀌었나 봐요 그대로 여전히 맛있네요 살짝 늦긴 했지만 서비스 주시 서비스 챙겨주시는 부모님 샐러드 커피 시켜 드렸는데 좋아하시네요 뜌레주르 먹을수 있다니 비오는 날인데도 깔끔하게 도착 서비스 챙겨주신 베이비 뜌레쥬르 숙대 입구 자주 이용 할게요 오고 빠른 서비스,요기요 서비스 준비중,12000,"서울 용산구 청파동2가 90-2 1,2층",그랑드카페 아메리카노（HOT）,https://images.deliveryhero.io/image/yogiyo/PARTNER_FR_IMG/%EB%9A%9C%EB%A0%88%EC%A5%AC%EB%A5%B4/2019-08-28/%EC%A0%9C%ED%9C%B4FR_20190826_%EB%9A%9C%EB%A0%88%EC%A5%AC%EB%A5%B4_%EA%B7%B8%EB%9E%91%EB%93%9C%EC%B9%B4%ED%8E%98%EC%95%84%EB%A9%94%EB%A6%AC%EC%B9%B4%EB%85%B8-HOT_1080x640.jpg?width=384&height=273&quality=100
1219,투썸플레이스-종각역점,빨라요  저번 넘도록 전화하니 서야 업체 왔다고 수습 하셔서 그러려니 빨대 보내셨네요 바쁜거 알바생 꼼꼼히 체크 해주세요 빠르고 저번 늦었어요 달달,11:00 - 22:00,12000,"서울 종로구 종로2가 84-4 2,3,4,5층",달콤한하루세트,https://images.deliveryhero.io/image/yogiyo/PARTNER_FR_IMG/%ED%88%AC%EC%8D%B8%ED%94%8C%EB%A0%88%EC%9D%B4%EC%8A%A4/2019-11-19/%EC%A0%9C%ED%9C%B4FR_20191113_%ED%88%AC%EC%8D%B8%ED%94%8C%EB%A0%88%EC%9D%B4%EC%8A%A4_%EB%8B%AC%EC%BD%A4%ED%95%9C%ED%95%98%EB%A3%A8%EC%84%B8%ED%8A%B8_1080x640.jpg?width=384&height=273&quality=100
1221,파스타마켓-대학로점,좋고 양도 많고 온도 뜨거운 상태 왔네요 파스타 이정 퀄리티 만족스러워요 누룽지 있었는데 그게 은근 느끼한데 코로나 나가는데 돼서 레몬 뿌려 먹으니 맛있는것 느끼 존맛 빠르고 매콤 하구 존맛 맥주 부르는 빠르고 기사 경로 확인 할수있어서 포장 비주 얼도 최고 설명 있으면 고를 편할거 수저 주는건 원래 실순 모르겠지만 먹어도 맛있네요 많네요 살짝 매콤 나서,요기요 서비스 준비중,12000,서울 종로구 명륜4가 103-6 1층,파마 투움바 1人,https://images.deliveryhero.io/image/yogiyo/PHOTOGRAPHER_IMG/%EC%84%9C%EC%9A%B8/%EC%84%9C%EC%9A%B8%EC%A2%85%EB%A1%9C%EA%B5%AC/502258_%ED%8C%8C%EC%8A%A4%ED%83%80%EB%A7%88%EC%BC%93-%EB%8C%80%ED%95%99%EB%A1%9C%EC%A0%90/DHK%EC%B4%AC%EC%98%81_20201204_502258_%ED%8C%8C%EC%8A%A4%ED%83%80%EB%A7%88%EC%BC%93-%EB%8C%80%ED%95%99%EB%A1%9C%EC%A0%90_%ED%8C%8C%EB%A7%88%ED%88%AC%EC%9B%80%EB%B0%94_1080x640.jpg?width=384&height=273&quality=100
1223,난달라커피와샌드위치,만드신 정성 느껴지는 재료 신선해서 좋았어요 커피 좋았지만 바닐라 라떼 달아서 아쉬웠어요  좋았어요 이른 아침 음료 샌드위치 예상 도착 초과 전화했는데 출발 했다고하 도착 음료 빨대 없는듯 샌드위치 먹었습니다만 늦어서 아쉽습니다 사장 사무실 간식 친절하게 해주시는 사장 감사 드립니다 들이 다른거 만들이 힘드셨을텐데 꼼꼼하게 만들어주셔서 커피 마셨 니당 올해 맛있는 샌드위치 부탁드립니다 사무실 간식 시켜 먹는네 아침 생각났어요 친절하신 사장 잇는 샌드위치 텁텁 깔끔한 커피 주말 그런지 아님 거리 멀어서 그런지 예상 길었어요 예상 맞춰서 도착 했구요 기본 샌드위치 가격 대비 만족스러웠고 샌드위치 느끼한 편이었어요 잇어요 잇어요 샌드위치 크로와상 샌드위치 건강한 재료 빵빵 아쉬운 라면 커피 따뜻한거 시켰는데 아이스커피 와서 괜찮아요 샌드위치 머리카락 나와서 전화 드렸는데 사과 주셔서 넘어갔어요 하시는 남자 친절하세요 다른건 좋은데 팥빙수 와서 속상했어요 냈는데 바닐라 라떼 좋구요 샌드위치 실해요 만드시면 갈텐데 채소 싱싱해서 씹히는 감도,요기요 서비스 준비중,12000,서울 중구 다동 70 한외빌딩 1층 134호,에그 치아바타 샌드위치,
