,title,review,hour,min_order,address,menu,menu_img
1885,설빙-서울인사점, 빠르게 블루베리 가득 들어있어 흑임자 비비 흑임자 아니니 참고 하세요 빨랐습니다 연유 주셨어요 빠르고 서비스  만족합니다 슈크림 붕어빵 서비스 미친듯이 먹어서 사진 지저분해요 인절미 토스트 인절미 빙수 진리 빠르고 먹고 있어요 서비스 토스트 애플 망고 익은 왔더라고요 달달 양도 많고 비오는데 고생 많으시구 녹지말라고 얼음 넣어주고 맛잇엇어 리뷰 이벤트 이벤트 양도 많고 서비스 인절미 토스트 빠르고 녹지 않게 오네요 하시는 분도 친절하고요 빙수 시원하고 서비스 과자 먹었 니당 빠르고 빙수 녹고   빠르구요 요청 들어주시고 서비스 팥빙수 설빙 인절미 처음 도전 선택 틀리지 않았음 느꼈습니다 서비스  더운 최고 빠르게 녹지 왔습니다 리뷰 이벤트 인절미 토스트 처음 보는데 직접 사먹게 같네요 과자 주셨네요 티라미수 빙수 맛있네요 치즈 큐브 추가 가격 대비 아쉽습니다 먹고나니 더위 가시네요 여름 빙수 서비스 인절미 토스트 주시 빠르고 더운 빠르고요 친정 부모님 가게 보내 드렸는데 양도 많고 서비스 맛있다고 칭찬 받았어요 자주 시킬께요 사진 없어서 죄송해요 빠른 녹지 않게 갔다주셔서 있고 먹었어용 더워 녹은게 아쉬워요 할인 리뷰 이벤트 자주 먹게 되네요 주세요 설빙 잇어용 늦는다고 아아 파이 챙겨주셨 숟가락 원래 안보 내주시나요 오고 좋았 니당 사진 찍는 까먹었네요 빙수 처음 보는데 매장 먹는 무척 편하고 좋았습니다 인절미 토스트 따뜻하고 서비스 주시 먹는 순간 행복했어요 할게요 깔끔하게 오구 먹고 즐겨 먹는 설빙 지원 리뷰 이벤트 빠르고 성공 호텔 격리 빙수 되서 좋았어요 녹지 않게 해주시 포장 깔끔하구요 리뷰 서비스 어제 연속 설빙 데이 좋아하는 설빙 처음 요기 통해 녹지 와서 리뷰 서비스 시켜 먹을께요 늦었어요 접수 안되서 했네요    주시던 분도 친절하시구 궁금해서 시켜 먹었는데 맛있었어용 설빙 가면 로투스 시켜 먹을 설빙 무난 괜찮게 시켰어요 아쉬운 숟가락 선택 보냈는데 와서 대략 난감했습니다 빙수 설빙 요즘 덥죠 빙수 시켜 시원하게 양도 많고 시켜 먹을게요 양도 많고 먹었던 빙수 였네요 수저 챙겨주셔서 빠르구요 깔끔한 포장 여윽시 설빙 빙수 드라이아이스 얼음 봉지 포장 스푼 분명 온건 문의 전화 추가 운운하는 훌륭한 서비스 역대 제대로 왔어요 소스 빼먹거나 있을수있다싶었는데 빙수 세트 통째 없네요 당황 빙수 제대로 왔음 좋았는데 숟가락 와서 당황 회사 이서 먹는데 숟가락 있음 야할까 여름철 바쁜건 이해 챙겨주세요 먹겠 오오 오유 오오 우유 냔냐아 이유 모르겠으나 예상 이십분 늦게 도착 인절미 빙수 들어가는 인절미 재료 소진 사전 연락 좋았습니다 대신 가루 뿌려주셔서 빙수 인절미 토스트 식어서 딱딱하고 인절미 들어있는지안 들어있는지 모를 실망 이었어요 매장 먹었다면 달랐을까요 다녀 설빙 가장 없었어요 연유 달아요 묽고 우유 탄것처럼 메론 잘라서 포장 해주셔서 먹기 편했어요 치즈 너무맛잇엇어 빠르고 줄었어여 빠르구요 녹아서 왔네요 빠르고 포장 성의 있게 해주셔서 감동 받았어요 자주 시켜 먹을게 왔어여 분만 오고 빙수 꿀떡 조합 좋습니다 얼음 녹음 신기함 빙수 시대 빠른 맛있는 만족스러웠어요 맛있어 설빙 살짝 적은듯 하였지만  아주 병원,12:20 - 20:20,4500,서울 종로구 인사동 39 2층,플레인요거트스무디,
1889,봉심식당,적었어요 스테이크 새우 바스 해먹 자취 바스 먹고 싶은데 새우 해동 시키고 귀찮아서 시켜 봤어요 처음 개봉 새우 안타깝다 들었는데 먹다 보니 충분하고 마늘 서비스 거인 바게트 왔는데 전혀 딱딱하지도 부드럽네요 미묘하게 매콤 입맛 종종 시켜 먹을듯 허브 같은게 그대로 먹기 불편했네요 바질 패스 떨어져서 대신 먹은것 빼고는 좋았 니당 가게 갔었는데 비슷해요 토마토 크림 모르겠는 어중간한 이긴 했지만 양도 많고 빨랐어요 양도 적당하고 재료 성하고 아주 납니다 파스타 이정 퀄리티 매우 만족 빠르고 먹기 많아서 남겼네요 음료수 없어서 살짝 아쉬웠어요 번창 하세요,요기요 서비스 준비중,5000,서울 종로구 명륜4가 70-3 지하1층,새우 감바스,https://images.deliveryhero.io/image/yogiyo/STOCK_IMG/%EA%B8%B0%ED%83%80%EC%99%B8%EA%B5%AD%EC%9D%8C%EC%8B%9D/%EC%9A%94%EB%A6%AC/%EC%8A%A4%ED%83%81_20200407_DHK%EC%B4%AC%EC%98%81_%EA%B0%90%EB%B0%94%EC%8A%A4_Side01_1080x640.jpg?width=384&height=273&quality=100
1893,쪽갈비제작소,최고 굿굿 자주 먹다가 자주 시켜 먹는데 양파 요청 친절한 쪽지 먹겠습니다 매운 갈비 매워요 냄새 다는 리뷰 걱정 시켰는데 가족 이서 매운거랑 매운거랑 시켰는데 배부르게 먹었 니당 배고플 시켜 먹을게요 코로나 힘드실텐데 화이팅 하세요 배민 시키다가 기요 하였는데 요즘 양파 백김치 빼고가져 다달라는 메모 무시 고기 작아지고 태운 부분 많고 갈수록 실망하게 되네요 리뷰 남기면 형식 신경 쓸테니 메모 남겨 달라 보게되 먹고 장염 걸리면 이유 찾았는데 무성의 요즘 직원 행동 음식 위생 관리 안되고있는건 가하는 맛있게잘 매운 맵다고 하셔서 제작 갈비 매운 갈비 매운 양념 돼지 냄새 커버 되는데 제작 갈비 냄새 나더라구요 중간 있으면 좋겠구 매운 소스 주시는것도 나쁘지 않을것 먹고있습니다,15:30 - 22:30,30000,서울특별시 용산구 이태원동 118-16,제작소 쪽갈비,https://images.deliveryhero.io/image/yogiyo/PHOTOGRAPHER_IMG/OD/25599_menu_810069.jpg?width=384&height=273&quality=100
1895,더족발-서울역점,막국수 와서 좋았어요 익스 프레 시켰는데 왔어요 허겁지겁 먹다가 정신차리고 리뷰 씁니다 고팠는데 김치 많았으면 입맛 까다로운 평가 기사 친절해요 막국수 봐서 모르겠는데 콜라 누룽지 왔고요 보쌈 기지 않아요 무난 친절해요 추천 족발 매웠어요,16:00 - 23:00,25000,"서울 중구 중림동 339-2 1,2층",족발＋쟁반막국수,https://images.deliveryhero.io/image/yogiyo/STOCK_IMG/%EC%A1%B1%EB%B0%9C%EB%B3%B4%EC%8C%88/%EC%A1%B1%EB%B0%9C/%EC%8A%A4%ED%83%81_20170823_foodad_fad05007_%EC%A1%B1%EB%B0%9C01_1080x640.jpg?width=384&height=273&quality=100
1897,개미집-종로점,맛있었는데 추가 삼겹살 냄새 나서 아쉬웠어요 익스 프레 처음 보는데 왔어요 기사 친절하시고 양도 당면 추가 하니까 먹고도 배부르네요 자극 지도 먹기 딱이었어요 먹다가 머리카락 나왔어요 포함 사무실 빼고 먹긴 신경 써주세요 괜찮은데 만원 씹을게 개정 곱창 없네요 곱창전골 음식 포장 깔끔해요 낚지 마리 들어간거 같네요 해달라 는데 밍밍 수준 뭔가 물이 많아서 너무하네요 호텔 야경 낙곱새 강력 추천 야무집니다 정확한 깔끔한 강추 베리 매장 직접 먹을 비해 적은거 같긴한데 빠르고 맛있는데 적어요 낙지 곱창 새우 아쉽지만 조리 잘못 했나 확인 매콤 하더라구요 괜찮은데 만원 씹을게 개정 곱창 없네요 곱창전골 음식 포장 깔끔해요 낚지 마리 들어간거 같네요 해달라 는데 밍밍 수준 뭔가 물이 많아서 너무하네요 호텔 야경 낙곱새 강력 추천 야무집니다 정확한 깔끔한 강추 베리 매장 직접 먹을 비해 적은거 같긴한데 빠르고 맛있는데 적어요 낙지 곱창 새우 아쉽지만 조리 잘못 했나 확인 매콤 하더라구요,10:30 - 21:30,20000,서울 종로구 관철동 12-13 포인트23 2층,낙곱새,https://images.deliveryhero.io/image/yogiyo/STOCK_IMG/%ED%95%9C%EC%8B%9D/%EC%9A%94%EB%A6%AC-%EB%B3%B6%EC%9D%8C%EB%A5%98/%EC%8A%A4%ED%83%81_20190813_DHK%EC%B4%AC%EC%98%81_%EB%82%99%EA%B3%B1%EC%83%88_Side01_1080x640.jpg?width=384&height=273&quality=100
1901,도야족발-신당점,빠르고 최고  족발 맛있네요 야채 신선하고 양도 많고 묵은지 짱짱 깔끔하고  보쌈 겉절이 백김치 막국수 보쌈 최고 사진 찍었네요 빠르고 고기 부드럽습니다 막국수 서비스 보쌈 요리 했는지 부들 보드랍고 살살 녹아요 족발 매웠지만 매운 음식 좋아하는 먹을것 빠르고 친절하 기사 보쌈 식을까봐 뽁뽁이 포장 해주신 사장 덕분 따뜻하게 족발 보쌈 도야 마늘 쌈장 주셔서 소주 시켰는데 사장 전화 주셔서 안된다고 친절히 설명 해주시고 현금 음식 돌려주셨네요 주류 시키시는 안되니 참고 하세요 먹어서 사진 찍었어요 양도 많아서 나눠서 나중 시켜 먹을게요 최고 족발 부드러워요 온도 적당하구 냄새 안나 감동 고민 계시다면 드셔 보시 자주 시켜 먹는 족발 보쌈 맛있는 집이예요 빠름 양도 많고 맛있어서 이틀 시켜 먹네요 빠르고   시켜 봤는데 보쌈 부드럽고 냄새 안나 매운 족발 매콤 있고 양도 많아서 좋았어요 쫄깃 반의 선택 네오 서비스 막국수 가격 대비 양도 많고 족발 서비스 막국수 번창 하세요 맛있게잘 많은것 깔끔하고  신당 촤고 맛있 보쌈 비계 평소 많았어요 빠르고 시키러 갑니다 대박 보쌈 진심 최고 묵은지 김치 좋아하는데 넉넉히 보내주셔서 감사해요 막국수 맛있네요 리뷰 이벤트 는데 막국수 왔어요 맛있엇어 남편 보쌈 매운 족발 시켜 먹어요 보쌈 식구 넉넉해요 오는 김치 족발 도야 족발 최고 보쌈 도야 족발 최고 쟁반 국수 도야 족발 최고 기대 개존맛 고기 부드럽고 김치 달달 마싯 먹었 니당 부드럽고 빠르고 양도 많고 양도 많고 빠르네요 먹어도 맛있는 도야 족발 채소 올라서 런가 상추 몇장 없어서 별하나 뺐어요  족발 가장 늦어서 식어서 있었어요 마지막 깔끔한 있었어요 막국수 양념 달콤하고 맛있었어오 족발 궁합 강한 양념 좋았어요 따뜻하게  양도 많고 주셔서 감사해요 일찍 도착 막국수 먹었고 백김치 넉넉히 주셔서 좋았어요 매운 음식 먹는 애기 보쌈 고기 먹어서 봤지만 나고 부드러웠으니까 아기 먹었을듯 예상 빠르게 도착  족발 먹었는데 막국수 소스 맛보셔 야할 서비스 막국수 소스 상한 건지 이상해서 세입 남겼어요 이상한 캔디 같은게 나머지   양도 시켜 드셔 보세용 사진 깜빡 양도 많고 먹자마자 큰거 시킬 후회 했네요 맛있어서 무조건 시켜 드세요 맛집 왔어요 음식 깔끔하고 좋네요 덕분 즐거운 주말 같습니다 많고요 기본 주먹밥 마늘 청양고추 새우젓 쌈장 상추 겉절이 묵은지 묵은지 맛있어 다른건 먹었네요 처음 먹었는데 강추 깔끔하고요 맛있네요 먹고있는 고심 였는데 맛있네요 기도 적당하고 막국스 나고 족발 쫄깃쫄깃 무난 후기 쓰는데 사장 비오는 바쁘실텐데 직접 주셔서 덕분 따뜻하게 왕뼈 차있어 절대 보장  요구사항 들어주시고 만족합니다 번창 하세요 두번째 시켰어요 남산 부장 보면서 화나 그런지 받자마자 많지 추가 요청 머쓱 그치만 요청 들어주셔서 감사해요 족발 비싸서 보쌈 시켜 먹지만 감동 번창 하시고 코로나 조심하세요 닫으면 리뷰 좋아서 입맛 맞네요 요청 꼼꼼히 챙겨주셔서 입맛 딱좋아요 양도 많고 요담 맛있었는데 뭔가 고기 부드럽고 맛있네요 직화 족도 양념 맛있더라고요 백김치 신김 친데 고기 먹으니 불족 고기 부스러지는 덩이 아쉽네요 예전 시켜 먹던 시켰는데 오고 만족 보쌈 시키는데 고기 부드럽고 겉절이 백김치 무생채 시켰는데 식구 먹기 충분했고요 리뷰 서비스 막국수 소스 있어 입맛 맞게 조절 좋네요 양도 많고 족발 보쌈 도야 시켜 먹어요 친절하시고 고기 나고 최고  족발 시키지만 보쌈 고기 살짝 달콤하고 쫀득 이전 보쌈 먹어서 족발 처음 시켰어요 왔고 포장 꼼꼼히 되어서 새거나 음식 상태 좋지 전혀 깔끔하게 왔어요 족발 눈물 주루 루루 야들야들 쫄깃 미칩니다 미쳐요 미쳐요 도야 족발 보쌈 족발 정착 만족합니다 번창 하세요  깔끔하고 백김치 맛있는거 넉넉합니다 막힙니다 포장 만족스럽습니다 평이 해봤는데 족발 주먹밥 막국수 짐하게 빠르고 서비스 주먹밥 사진 첨부 할수있는게 안타깝네요 맛있지만 매운 족발 탑인것 뱌부르 먹었고 넉넉하게주신 반찬 쌈장 백김치 상추 놀라고 조만간 하겠습니다 번창 하세용 믿고 먹는 도야 족발 끊었던 보쌈 시작 도야 족발 보쌈 족발 먹다가 보쌈 처음 시켰는데 만족스럽네요 양도 많고 빠르고 최애 맛집 구성 괜찮고 끔하고 양도 양도 많고 최고 서비스 파세요 양도 많고 빠르고 양도 많고 깔끔하고 친절하시고 잡내도 안나 막국수 고기 부드러우면 좋겠어요 묵은지 김치 족발 맛있네요 야채 신선하고 양도 많고 묵은지,16:00 - 00:00,20000,서울 중구 신당동 852번지 e편한세상 123동 상가 2층 8호,보쌈 小（600g）,https://images.deliveryhero.io/image/yogiyo/PARTNER_FR_IMG/%EB%8F%84%EC%95%BC%EC%A1%B1%EB%B0%9C/2020-12-23/%EC%A0%9C%ED%9C%B4FR_20201222_%EB%8F%84%EC%95%BC%EC%A1%B1%EB%B0%9C_%EB%B3%B4%EC%8C%88.jpg?width=384&height=273&quality=100
1905,송추가마골인어반-광화문점,막었어요 도시락 드네 분홍 소세지 있으면 좋겠어요 묵은지 부드러워서 돼지고기 지방 라드 몰랑몰랑하고 김치 맛있네요 갈비탕 계란 지단 고명 좋구요 고기 서더 리가 붙어있는 갈비 김치 맛있네요 시킬께요 막었어요 도시락 드네 분홍 소세지 있으면 좋겠어요 묵은지 부드러워서 돼지고기 지방 라드 몰랑몰랑하고 김치 맛있네요 갈비탕 계란 지단 고명 좋구요 고기 서더 리가 붙어있는 갈비 김치 맛있네요 시킬께요,16:30 - 20:30,20000,서울 종로구 도렴동 65 센터포인트광화문 2층 203호,돼지불고기 도시락,https://images.deliveryhero.io/image/yogiyo/STOCK_IMG/%ED%95%9C%EC%8B%9D/%EB%8F%84%EC%8B%9C%EB%9D%BD/%EC%8A%A4%ED%83%81_20170825_foodad_fad50911_%EB%B6%88%EA%B3%A0%EA%B8%B0%EB%8F%84%EC%8B%9C%EB%9D%BD01_1080x640.jpg?width=384&height=273&quality=100
1909,어사출또-북창점,미끄러운데 해주셔서 멍게 먹고 싶어서 싱싱하고 소자 먹기 적긴 적넹 싱싱하고 맛있었어용 사장 친절한거 신지 광어 신선하고 쫄깃하 간정 걸려서 안타깝지만 맛있어서 패쓰 레쓰비 뇌물 귀여운거 아닌가요 콜라 였음 환상 이었겠지만 커피 주신것도 감사  물회 느낌 납니다 매운탕 시켰는대 매운탕 와서 전화했더니 안되게 매운탕 보내주시고 채소 추가 보내주셨다 친구 갖고싶어 소맥 주셨고 친절 사진안 찍은걸 먹고 알았어요 냉장고 넣어놨다가 먹었는데도 쭬깃 하니 작은거 시켰는데 둘이서 배부르게 양도 해삼 먹을수있어 행복하네요 양념 구성 어사 또혜 광어 광어 지느러미 같이오던데 요긴 와서 별하나 뺐어요 고맙습니다 회도 싱싱해요 적당 플러스 매운탕 먹었 읍니 매운탕 미나리 쑥갓 추가 안되나요 친절 속도 전복 버터 구이 시켰는데 전복 새우 잔뜩 있네요 정체 불명 이상한 냄새 먹겠어요 안녕하세요 매운탕 막혀요 짱짱 미끄러운데 해주셔서 멍게 먹고 싶어서 싱싱하고 소자 먹기 적긴 적넹 싱싱하고 맛있었어용 사장 친절한거 신지 광어 신선하고 쫄깃하 간정 걸려서 안타깝지만 맛있어서 패쓰 레쓰비 뇌물 귀여운거 아닌가요 콜라 였음 환상 이었겠지만 커피 주신것도 감사  물회 느낌 납니다 매운탕 시켰는대 매운탕 와서 전화했더니 안되게 매운탕 보내주시고 채소 추가 보내주셨다 친구 갖고싶어 소맥 주셨고 친절 사진안 찍은걸 먹고 알았어요 냉장고 넣어놨다가 먹었는데도 쭬깃 하니 작은거 시켰는데 둘이서 배부르게 양도 해삼 먹을수있어 행복하네요 양념 구성 어사 또혜 광어 광어 지느러미 같이오던데 요긴 와서 별하나 뺐어요 고맙습니다 회도 싱싱해요 적당 플러스 매운탕 먹었 읍니 매운탕 미나리 쑥갓 추가 안되나요 친절 속도 전복 버터 구이 시켰는데 전복 새우 잔뜩 있네요 정체 불명 이상한 냄새 먹겠어요 안녕하세요 매운탕 막혀요 짱짱,14:00 - 01:50,23000,"서울 중구 북창동 17-8 1,2층",광어＋우럭,
1913,동원참치-광화문본점, 잘나와서 기분 좋게 자주 시켜 먹으려 최고 최고 대박 참치 좋아하는데 코로나 때매 인근 지역 군데 시켜 실망해서 먹고있었는데 와우 사장 서비스 이세 그렇고 양도 그렇고 만족합니다 회식 자주가는데 진심 미쳤다 금욜 빠르네요 참치 참다랑어 프로 시켰는데 묵은지 나고 와사비 고급 먹을께요 많고 할게요 참치 먹을 모르고 처음 보는데 많고 빠르고 유부초밥 묵은지 요즘 돌아다니질 시켜 직접 먹던거처럼 맛있네요 신선하고  잘나와서 기분 좋게 자주 시켜 먹으려 최고 최고 대박 참치 좋아하는데 코로나 때매 인근 지역 군데 시켜 실망해서 먹고있었는데 와우 사장 서비스 이세 그렇고 양도 그렇고 만족합니다 회식 자주가는데 진심 미쳤다 금욜 빠르네요 참치 참다랑어 프로 시켰는데 묵은지 나고 와사비 고급 먹을께요 많고 할게요 참치 먹을 모르고 처음 보는데 많고 빠르고 유부초밥 묵은지 요즘 돌아다니질 시켜 직접 먹던거처럼 맛있네요,11:00 - 20:00,23000,서울특별시 종로구 적선동 80 적선현대빌딩 적선현대빌딩,회덮밥,https://images.deliveryhero.io/image/yogiyo/STOCK_IMG/%EC%9D%BC%EC%8B%9D%EB%8F%88%EA%B9%8C%EC%8A%A4/%EB%B0%A5%EB%A5%98/%EC%8A%A4%ED%83%81_20190701_DHK%EC%B4%AC%EC%98%81_%EC%B0%B8%EC%B9%98%ED%9A%8C%EB%8D%AE%EB%B0%A5_Side_01_1080x640.jpg?width=384&height=273&quality=100
1917,오차드1974-2호점,퀄리티더 익스 프레 늦게 왔지만 스테이크 리조또 추합니다 ,17:00 - 20:00,24000,서울 중구 신당동 52-231 진호빌딩 1층,엔쵸비 오일 파스타,https://images.deliveryhero.io/image/yogiyo/PHOTOGRAPHER_IMG/%EC%84%9C%EC%9A%B8/%EC%84%9C%EC%9A%B8%EC%A4%91%EA%B5%AC/494513_%EC%98%A4%EC%B0%A8%EB%93%9C1974-2%ED%98%B8%EC%A0%90/DHK%EC%B4%AC%EC%98%81_20201203_494513_%EC%98%A4%EC%B0%A8%EB%93%9C1974-2%ED%98%B8%EC%A0%90_%EC%97%94%EC%B5%B8%EB%B9%84%EC%98%A4%EC%9D%BC%ED%8C%8C%EC%8A%A4%ED%83%80_1080x640.jpg?width=384&height=273&quality=100
